# tcpdump -i eth0 tcp

17:14:08.142090 IP 165.22.226.129.ssh > 38.17.56.132.52196: Flags [P.], seq 274772:274928, ack 145, win 501, length 156
17:14:08.142221 IP 165.22.226.129.ssh > 38.17.56.132.52196: Flags [P.], seq 274928:275084, ack 145, win 501, length 156
17:14:08.142366 IP 165.22.226.129.ssh > 38.17.56.132.52196: Flags [P.], seq 275084:275240, ack 145, win 501, length 156
17:14:08.142498 IP 165.22.226.129.ssh > 38.17.56.132.52196: Flags [P.], seq 275240:275396, ack 145, win 501, length 156
17:14:08.142618 IP 165.22.226.129.ssh > 38.17.56.132.52196: Flags [P.], seq 275396:275552, ack 145, win 501, length 156
17:14:08.142785 IP 165.22.226.129.ssh > 38.17.56.132.52196: Flags [P.], seq 275552:275708, ack 145, win 501, length 156
17:14:08.142930 IP 165.22.226.129.ssh > 38.17.56.132.52196: Flags [P.], seq 275708:275864, ack 145, win 501, length 156
17:14:08.143064 IP 165.22.226.129.ssh > 38.17.56.132.52196: Flags [P.], seq 275864:276020, ack 145, win 501, length 156
17:14:08.143198 IP 165.22.226.129.ssh > 38.17.56.132.52196: Flags [P.], seq 276020:276176, ack 145, win 501, length 156
17:14:08.143346 IP 165.22.226.129.ssh > 38.17.56.132.52196: Flags [P.], seq 276176:276332, ack 145, win 501, length 156
17:14:08.143506 IP 165.22.226.129.ssh > 38.17.56.132.52196: Flags [P.], seq 276332:276488, ack 145, win 501, length 156
17:14:08.143649 IP 165.22.226.129.ssh > 38.17.56.132.52196: Flags [P.], seq 276488:276644, ack 145, win 501, length 156
17:14:08.143788 IP 165.22.226.129.ssh > 38.17.56.132.52196: Flags [P.], seq 276644:276800, ack 145, win 501, length 156
17:14:08.143999 IP 165.22.226.129.ssh > 38.17.56.132.52196: Flags [P.], seq 276800:276956, ack 145, win 501, length 156
17:14:08.144156 IP 165.22.226.129.ssh > 38.17.56.132.52196: Flags [P.], seq 276956:277112, ack 145, win 501, length 156
17:14:08.148778 IP 38.17.56.132.52196 > 165.22.226.129.ssh: Flags [.], ack 267596, win 16516, length 0
17:14:08.148778 IP 38.17.56.132.52196 > 165.22.226.129.ssh: Flags [P.], seq 145:181, ack 267596, win 16516, length 36
17:14:08.148821 IP 165.22.226.129.ssh > 38.17.56.132.52196: Flags [P.], seq 277112:277268, ack 145, win 501, length 156
^C
1810 packets captured
1810 packets received by filter
0 packets dropped by kernel