# tcpdump -n -i eth0

17:13:25.579348 IP 165.22.226.129.22 > 38.17.56.132.52196: Flags [P.], seq 593292:593448, ack 325, win 501, length 156
17:13:25.579513 IP 165.22.226.129.22 > 38.17.56.132.52196: Flags [P.], seq 593448:593604, ack 325, win 501, length 156
17:13:25.579676 IP 165.22.226.129.22 > 38.17.56.132.52196: Flags [P.], seq 593604:593760, ack 325, win 501, length 156
17:13:25.579852 IP 165.22.226.129.22 > 38.17.56.132.52196: Flags [P.], seq 593760:593916, ack 325, win 501, length 156
17:13:25.580047 IP 165.22.226.129.22 > 38.17.56.132.52196: Flags [P.], seq 593916:594072, ack 325, win 501, length 156
17:13:25.580248 IP 165.22.226.129.22 > 38.17.56.132.52196: Flags [P.], seq 594072:594228, ack 325, win 501, length 156
17:13:25.580428 IP 165.22.226.129.22 > 38.17.56.132.52196: Flags [P.], seq 594228:594384, ack 325, win 501, length 156
17:13:25.580631 IP 165.22.226.129.22 > 38.17.56.132.52196: Flags [P.], seq 594384:594540, ack 325, win 501, length 156
17:13:25.580815 IP 165.22.226.129.22 > 38.17.56.132.52196: Flags [P.], seq 594540:594696, ack 325, win 501, length 156
17:13:25.581017 IP 165.22.226.129.22 > 38.17.56.132.52196: Flags [P.], seq 594696:594852, ack 325, win 501, length 156
17:13:25.581218 IP 165.22.226.129.22 > 38.17.56.132.52196: Flags [P.], seq 594852:595008, ack 325, win 501, length 156
17:13:25.581426 IP 165.22.226.129.22 > 38.17.56.132.52196: Flags [P.], seq 595008:595164, ack 325, win 501, length 156
17:13:25.581591 IP 165.22.226.129.22 > 38.17.56.132.52196: Flags [P.], seq 595164:595320, ack 325, win 501, length 156
17:13:25.588013 IP 38.17.56.132.52196 > 165.22.226.129.22: Flags [.], ack 588352, win 16511, length 0
17:13:25.588013 IP 38.17.56.132.52196 > 165.22.226.129.22: Flags [P.], seq 325:361, ack 588508, win 16510, length 36
17:13:25.588089 IP 165.22.226.129.22 > 38.17.56.132.52196: Flags [P.], seq 595320:595476, ack 325, win 501, length 156
17:13:25.588318 IP 38.17.56.132.52196 > 165.22.226.129.22: Flags [.], ack 592044, win 16515, length 0
17:13:25.588319 IP 38.17.56.132.52196 > 165.22.226.129.22: Flags [.], ack 592356, win 16513, length 0
^C
3886 packets captured
3899 packets received by filter
13 packets dropped by kernel
