#tcpdump -i eth0

17:02:52.844642 IP 165.22.226.129.ssh > 38.17.56.132.52196: Flags [P.], seq 6054124:6054288, ack 3277, win 501, length 164
17:02:52.844750 IP 165.22.226.129.ssh > 38.17.56.132.52196: Flags [P.], seq 6054288:6054452, ack 3277, win 501, length 164
17:02:52.844847 IP 165.22.226.129.ssh > 38.17.56.132.52196: Flags [P.], seq 6054452:6054616, ack 3277, win 501, length 164
17:02:52.844937 IP 165.22.226.129.ssh > 38.17.56.132.52196: Flags [P.], seq 6054616:6054780, ack 3277, win 501, length 164
17:02:52.845020 IP 165.22.226.129.ssh > 38.17.56.132.52196: Flags [P.], seq 6054780:6054944, ack 3277, win 501, length 164
17:02:52.845108 IP 165.22.226.129.ssh > 38.17.56.132.52196: Flags [P.], seq 6054944:6055108, ack 3277, win 501, length 164
17:02:52.845190 IP 165.22.226.129.ssh > 38.17.56.132.52196: Flags [P.], seq 6055108:6055272, ack 3277, win 501, length 164
17:02:52.845284 IP 165.22.226.129.ssh > 38.17.56.132.52196: Flags [P.], seq 6055272:6055436, ack 3277, win 501, length 164
17:02:52.845333 IP 38.17.56.132.52196 > 165.22.226.129.ssh: Flags [P.], seq 3277:3313, ack 5996220, win 2061, length 36
^C
37615 packets captured
37615 packets received by filter
0 packets dropped by kernel