# tcpdump -i eth0 port 22

17:14:36.232855 IP 165.22.226.129.ssh > 38.17.56.132.52196: Flags [P.], seq 197996:198152, ack 109, win 501, length 156
17:14:36.232981 IP 165.22.226.129.ssh > 38.17.56.132.52196: Flags [P.], seq 198152:198308, ack 109, win 501, length 156
17:14:36.233101 IP 165.22.226.129.ssh > 38.17.56.132.52196: Flags [P.], seq 198308:198464, ack 109, win 501, length 156
17:14:36.233257 IP 165.22.226.129.ssh > 38.17.56.132.52196: Flags [P.], seq 198464:198620, ack 109, win 501, length 156
17:14:36.233432 IP 165.22.226.129.ssh > 38.17.56.132.52196: Flags [P.], seq 198620:198776, ack 109, win 501, length 156
17:14:36.233560 IP 165.22.226.129.ssh > 38.17.56.132.52196: Flags [P.], seq 198776:198932, ack 109, win 501, length 156
17:14:36.233713 IP 165.22.226.129.ssh > 38.17.56.132.52196: Flags [P.], seq 198932:199088, ack 109, win 501, length 156
17:14:36.233834 IP 165.22.226.129.ssh > 38.17.56.132.52196: Flags [P.], seq 199088:199244, ack 109, win 501, length 156
17:14:36.233950 IP 165.22.226.129.ssh > 38.17.56.132.52196: Flags [P.], seq 199244:199400, ack 109, win 501, length 156
17:14:36.234068 IP 165.22.226.129.ssh > 38.17.56.132.52196: Flags [P.], seq 199400:199556, ack 109, win 501, length 156
17:14:36.234191 IP 165.22.226.129.ssh > 38.17.56.132.52196: Flags [P.], seq 199556:199712, ack 109, win 501, length 156
17:14:36.234308 IP 165.22.226.129.ssh > 38.17.56.132.52196: Flags [P.], seq 199712:199868, ack 109, win 501, length 156
17:14:36.234426 IP 165.22.226.129.ssh > 38.17.56.132.52196: Flags [P.], seq 199868:200024, ack 109, win 501, length 156
17:14:36.234544 IP 165.22.226.129.ssh > 38.17.56.132.52196: Flags [P.], seq 200024:200180, ack 109, win 501, length 156
17:14:36.234664 IP 165.22.226.129.ssh > 38.17.56.132.52196: Flags [P.], seq 200180:200336, ack 109, win 501, length 156
17:14:36.238598 IP 38.17.56.132.52196 > 165.22.226.129.ssh: Flags [P.], seq 109:145, ack 189000, win 16510, length 36
17:14:36.238644 IP 165.22.226.129.ssh > 38.17.56.132.52196: Flags [P.], seq 200336:200492, ack 145, win 501, length 156
^C
1297 packets captured
1298 packets received by filter
0 packets dropped by kernel
